{
  "schema_version": "0.1",
  "series_id": "SERIES-TEMPLATE",
  "session_id": "AEON-SESSION-TEMPLATE",
  "participant_id": "PSEUDONYM-ONLY",
  "protocol_id": "pilot.void_x_response_crystallization.invisibilidad.v0_1",
  "started_at": "2026-01-01T00:00:00Z",
  "observations": [],
  "engine_records": [],
  "derived_metrics": [
    {
      "metric_id": "void_response_slope",
      "value": null,
      "unit": "felt_presence_points_per_silence_ratio",
      "status": "derived_metric",
      "preconditions_met": false,
      "calculation": "OLS slope of felt_presence against silence_ratio on C1/C2/C3 only.",
      "interpretation": "Characterizes within-session sensitivity; no wound/crystallization diagnosis."
    },
    {
      "metric_id": "hysteresis_delta_medium",
      "value": null,
      "unit": "felt_presence_points",
      "status": "derived_metric",
      "preconditions_met": false,
      "calculation": "felt_presence(C4_MED_DESC) - felt_presence(C2_MED_ASC).",
      "interpretation": "Non-zero value indicates path dependence at the same 50% silence condition in this session."
    },
    {
      "metric_id": "hysteresis_delta_low",
      "value": null,
      "unit": "felt_presence_points",
      "status": "derived_metric",
      "preconditions_met": false,
      "calculation": "felt_presence(C5_LOW_DESC) - felt_presence(C1_LOW_ASC).",
      "interpretation": "Non-zero value indicates path dependence at the same 20% silence condition in this session."
    },
    {
      "metric_id": "recovery_time_s",
      "value": null,
      "unit": "s",
      "status": "derived_metric",
      "preconditions_met": false,
      "calculation": "First recovery point where |felt_presence - baseline| <= 1 point and remains within tolerance if a later recovery point exists.",
      "interpretation": "Experimental recovery metric; 1-point tolerance is a pilot convention, not a validated clinical threshold."
    },
    {
      "metric_id": "persistence_auc",
      "value": null,
      "unit": "felt_presence_point_seconds_normalized",
      "status": "derived_metric",
      "preconditions_met": false,
      "calculation": "Discrete area of |felt_presence(t)-baseline| over immediate_post, recovery_60s and recovery_180s, normalized by observed recovery duration.",
      "interpretation": "Experimental persistence of the reported response."
    }
  ],
  "interpretation_boundary": "Derived response metrics characterize this observed series; they do not diagnose a wound, prove a symbolic crystallization, or establish signal causality."
}